headline,url
Kamala Harris selects Minnesota Governor Tim Walz as running mate,https://english.elpais.com/usa/elections/2024-08-06/kamala-harris-selects-minnesota-governor-tim-walz-as-her-running-mate.html
Harris and Trump duel in key states,https://english.elpais.com/usa/elections/2024-08-06/harris-and-trump-duel-in-key-states.html
Mexican president claims that El Chapo’s son agreed to turn himself over to the United States,https://english.elpais.com/international/2024-08-06/mexican-president-claims-that-el-chapos-son-agreed-to-turn-himself-over-to-the-united-states.html
Ukraine’s great silent victory: The reconquest of the Black Sea,https://english.elpais.com/international/2024-08-06/ukraines-great-silent-victory-the-reconquest-of-the-black-sea.html
"‘Loki,’ the new dinosaur with giant horns that dates back 78 million years",https://english.elpais.com/science-tech/2024-08-06/meet-loki-the-new-dinosaur-with-giant-horns-that-dates-back-78-million-years.html
Smallest arm bone ever found sheds light on the Flores ‘hobbits’,https://english.elpais.com/science-tech/2024-08-06/smallest-arm-bone-ever-found-sheds-light-on-the-mystery-of-the-flores-hobbits.html
"Jennifer Lopez, furious with Ben Affleck, looks for a new house away from him for $68 million ",https://english.elpais.com/people/2024-08-06/jennifer-lopez-furious-with-ben-affleck-looks-for-a-new-house-away-from-him-for-68-million.html
Fueling racism after the Southport murders in the UK: This is how the global industry of lies works,https://english.elpais.com/international/2024-08-06/fueling-racism-after-the-southport-murders-in-the-uk-this-is-how-the-global-industry-of-lies-works.html
Venezuelan opposition seeks alternatives to make its votes count,https://english.elpais.com/international/2024-08-06/venezuelan-opposition-seeks-alternatives-to-make-its-votes-count.html
Fragile interest rate balance at risk as US market cools ,https://english.elpais.com/economy-and-business/2024-08-06/fragile-interest-rate-balance-at-risk-as-us-market-cools.html
A prisoner swap that portrays Putin’s Russia,https://english.elpais.com/international/2024-08-06/a-prisoner-swap-that-portrays-putins-russia.html
Born without arms or legs: the young man who symbolizes how America neglects its most vulnerable farmhands,https://english.elpais.com/usa/2024-08-04/born-without-arms-or-legs-the-young-man-who-symbolizes-how-america-neglects-its-most-vulnerable-farmhands.html
Understanding the sudden rise of type 2 diabetes in children,https://english.elpais.com/health/2024-08-04/understanding-the-sudden-rise-of-type-2-diabetes-in-children.html
New anti-obesity pills threaten Eli Lilly and Novo Nordisk’s stock market empire,https://english.elpais.com/economy-and-business/2024-08-04/new-anti-obesity-pills-threaten-eli-lilly-and-novo-nordisks-stock-market-empire.html
J Balvin: ‘There are times when it is difficult to maintain confidence in yourself… and in others’,https://english.elpais.com/culture/2024-08-05/j-balvin-there-are-times-when-it-is-difficult-to-maintain-confidence-in-yourself-and-in-others.html
"Barry Keoghan, the Irishman who overcame a tragic childhood to become the actor everyone wants to hire",https://english.elpais.com/culture/2024-08-05/barry-keoghan-the-irishman-who-overcame-a-tragic-childhood-to-become-the-actor-everyone-wants-to-hire.html
From Brando to ‘The Bear’: How a simple white T-shirt has shaped masculinity for 100 years,https://english.elpais.com/lifestyle/2024-08-04/from-brando-to-the-bear-how-a-simple-white-t-shirt-has-shaped-masculinity-for-100-years.html
Tobey Maguire’s Hollywood hiatus: Why the ‘Spider-Man’ star preferred to fly under the radar,https://english.elpais.com/culture/2024-08-04/tobey-maguires-hollywood-hiatus-why-the-spider-man-star-preferred-to-fly-under-the-radar.html
Why mountaineering will never be a sport,https://english.elpais.com/sports/2024-08-05/why-mountaineering-will-never-be-a-sport.html
"Tanya Katerí Hernández, Afro-Latina researcher: ‘Those who love you most can at the same time harbor racist thoughts and attitudes’",https://english.elpais.com/usa/2024-08-05/tanya-kateri-hernandez-afro-latina-researcher-those-who-love-you-most-can-at-the-same-time-harbor-racist-thoughts-and-attitudes.html
This is how the brain behaves during a psychedelic trip,https://english.elpais.com/health/2024-08-03/this-is-how-the-brain-behaves-during-a-psychedelic-trip.html
How to crash a football-field-sized habitable spacecraft into Earth,https://english.elpais.com/science-tech/2024-08-03/how-to-crash-a-football-field-sized-habitable-spacecraft-into-earth.html
The creator of the ghost summit of Nobel winners also made up a research center in Africa,https://english.elpais.com/international/2024-08-02/the-creator-of-the-ghost-summit-of-nobel-winners-also-made-up-a-research-center-in-africa.html
Spain begins the process to declare its first marine national park on the island of El Hierro,https://english.elpais.com/climate/2024-07-30/spain-begins-the-process-to-declare-its-first-marine-national-park-on-the-island-of-el-hierro.html
"United States loses its dominance in swimming, as Australia, France and China win gold",https://english.elpais.com/sports/olympic-games/2024-08-05/united-states-loses-its-dominance-in-swimming-as-australia-france-and-china-win-gold.html
"Yiech Pur Biel, Olympic refugee athlete: ‘The first time I really ran, I ran for my life’",https://english.elpais.com/sports/2024-07-26/yiech-pur-biel-olympic-refugee-athlete-the-first-time-i-really-ran-i-ran-for-my-life.html
New anti-obesity pills threaten Eli Lilly and Novo Nordisk’s stock market empire,https://english.elpais.com/economy-and-business/2024-08-04/new-anti-obesity-pills-threaten-eli-lilly-and-novo-nordisks-stock-market-empire.html
Americans’ travel bug for Europe is too much of a good thing,https://english.elpais.com/economy-and-business/2024-08-01/americans-travel-bug-for-europe-is-too-much-of-a-good-thing.html
Investors look to the Fed for clues about rate cuts,https://english.elpais.com/economy-and-business/2024-07-31/investors-look-to-the-fed-for-clues-about-rate-cuts.html
"The mystery of Argentina’s gold: Milei admits that it was transferred abroad, without specifying the quantities or destination",https://english.elpais.com/economy-and-business/2024-07-28/the-mystery-of-argentinas-gold-milei-admits-that-it-was-transferred-abroad-without-specifying-the-quantities-or-destination.html
"Josh Homme, Queens of the Stone Age founder: The fragility of a tough guy ",https://english.elpais.com/culture/2024-08-03/josh-homme-queens-of-the-stone-age-founder-the-fragility-of-a-tough-guy.html
Days of silk and gold for those collecting legendary designs ,https://english.elpais.com/culture/2024-08-04/days-of-silk-and-gold-for-those-collecting-legendary-designs.html
How the little-known American saga ‘Blackwater’ sold almost two million novels in Europe ,https://english.elpais.com/culture/2024-08-03/how-the-little-known-american-saga-blackwater-sold-almost-two-million-novels-in-europe.html
A demolished communist palace and other rubble: How Berlin is managing its GDR buildings and monuments,https://english.elpais.com/international/2024-07-28/a-demolished-communist-palace-and-other-rubble-how-berlin-is-managing-its-gdr-buildings-and-monuments.html
"John Zorn, the expansive universe of a jazz genius  ",https://english.elpais.com/culture/2024-07-31/john-zorn-the-expansive-universe-of-a-jazz-genius.html
‘A bad roommate is like a toxic partner’: When sharing an apartment becomes a nightmare,https://english.elpais.com/lifestyle/2024-08-04/a-bad-roommate-is-like-a-toxic-partner-when-sharing-an-apartment-becomes-a-nightmare.html
"Goodbye to luggage worries: The apps and gadgets to pack, measure and track your bags",https://english.elpais.com/travel/2024-08-02/goodbye-to-luggage-worries-the-apps-and-gadgets-to-pack-measure-and-track-your-bags.html
Why it’s not good to replay conversations in your head,https://english.elpais.com/health/2024-08-03/why-its-not-good-to-replay-conversations-in-your-head.html
From Finasteride to Invisalign: The (extreme) aesthetic cocktail of what makes a man sexy today ,https://english.elpais.com/lifestyle/2024-07-28/from-finasteride-to-invisalign-the-extreme-aesthetic-cocktail-of-what-makes-a-man-sexy-today.html
Justin Timberlake has driver’s license suspended over DWI arrest,https://english.elpais.com/people/2024-08-02/justin-timberlake-has-drivers-license-suspended-over-dwi-arrest.html
"Glen Powell, Hollywood’s last great male hope: ‘If you’re looking for the definition of a movie star, that’s him’",https://english.elpais.com/culture/2024-07-29/glen-powell-hollywoods-last-great-male-hope-if-youre-looking-for-the-definition-of-a-movie-star-thats-him.html
"Without a tour, without a home and in the middle of a marital crisis: Jennifer Lopez’s bittersweet 55th birthday",https://english.elpais.com/people/2024-07-24/without-a-tour-without-a-home-and-in-the-middle-of-a-marital-crisis-jennifer-lopezs-bittersweet-55th-birthday.html
"María Gabriela de Faría: The Venezuelan actress who triumphs in Hollywood, but yearns ‘to return home’",https://english.elpais.com/culture/2024-07-21/maria-gabriela-de-faria-the-venezuelan-actress-who-triumphs-in-hollywood-but-yearns-to-return-home.html
"A visit to Le Bristol, the hotel hosting the rich and famous during the Paris Olympic Games  ",https://english.elpais.com/sports/olympic-games/2024-08-02/a-visit-to-le-bristol-the-hotel-hosting-the-rich-and-famous-during-the-paris-olympic-games.html
How displaced Syrians are exploited on social media for food,https://english.elpais.com/international/2024-08-03/how-displaced-syrians-are-exploited-on-social-media-for-food-i-have-to-be-on-my-feet-in-front-of-the-camera-with-other-kids-for-hours-so-that-the-tiktokers-can-get-donations.html
"Arizona, the great battle for the border state",https://english.elpais.com/usa/elections/2024-08-03/arizona-the-great-battle-for-the-border-state.html
"Ludovic Slimak, paleoanthropologist: ‘We’ve killed Neanderthals for the second time by not wanting to understand them’  ",https://english.elpais.com/science-tech/2024-08-04/ludovic-slimak-paleoanthropologist-weve-killed-neanderthals-for-the-second-time-by-not-wanting-to-understand-them.html
Listen now LOS40 USA,https://los40.us/
Rosalía Is Back: Lisa (Blackpink) Confirms Collaboration ‘New Woman’,https://los40.us/2024/rosalia-is-back-lisa-blackpink-confirms-collaboration-new-woman-23360.html
Zac Efron Speaks Out After Hospitalization Due to Pool Incident,https://los40.us/2024/zac-efron-speaks-out-after-hospitalization-due-to-pool-incident-23338.html
EL PAÍS offers free Spanish lessons with Gymglish,https://english.elpais.com/economy-and-business/2021-11-15/el-pais-offers-free-spanish-lessons-with-gymglish.html
HRW calls on the US to end solitary confinement in migrant detention centers,https://english.elpais.com/usa/2024-08-01/hrw-calls-on-the-us-to-end-solitary-confinement-in-migrant-detention-centres.html
Lila Abed: ‘The bilateral relationship between the US and Mexico is one of the few that affects the daily lives of millions of people’,https://english.elpais.com/international/2024-07-24/lila-abed-the-bilateral-relationship-between-the-us-and-mexico-is-one-of-the-few-that-affects-the-daily-lives-of-millions-of-people.html
International diplomacy races to avoid Mideast escalation after assassinations of Hamas and Hezbollah leaders,https://english.elpais.com/international/2024-08-02/international-diplomacy-races-to-avoid-mideast-escalation-after-assassinations-of-hamas-and-hezbollah-leaders.html
Russia frees reporter Evan Gershkovich and others in biggest prisoner swap with the West in decades,https://english.elpais.com/international/2024-08-01/russia-frees-reporter-evan-gershkovich-and-others-in-biggest-prisoner-swap-with-the-west-in-decades.html
Who won the Venezuelan election? Opposition data is more verifiable than the official figures,https://english.elpais.com/international/2024-08-02/who-won-the-venezuelan-election-opposition-data-is-more-verifiable-than-the-official-figures.html
Venezuela kicks off its most uncertain presidential campaign,https://english.elpais.com/international/2024-08-01/a-huipil-and-a-surfboard-patricia-ornelas-dances-on-the-waters-of-the-pacific.html
"US economy expands more than expected in second quarter, boosted by spending",https://english.elpais.com/economy-and-business/2024-07-25/us-economy-expands-more-than-expected-in-second-quarter-boosted-by-spending.html
An economic paradox: When savings are both a good and a bad idea,https://english.elpais.com/economy-and-business/2024-07-21/446-million-for-a-dinosaur-the-other-kinds-of-wall-street-investments.html
A cinematic exorcism for Hitler’s birthplace,https://english.elpais.com/culture/2024-07-28/a-cinematic-exorcism-for-hitlers-birthplace.html
Rock concerts: The greatest collective celebration of our time,https://english.elpais.com/culture/2024-07-27/rock-concerts-the-greatest-collective-celebration-of-our-time.html
"Marisol Soengas, cancer researcher and tumor patient: ‘We shouldn’t say that everything is going to be all right’",https://english.elpais.com/science-tech/2024-07-29/marisol-soengas-cancer-researcher-and-tumor-patient-we-shouldnt-say-that-everything-is-going-to-be-all-right.html
Latest solar superstorm blinded the systems that prevent satellites from crashing in space   ,https://english.elpais.com/science-tech/2024-07-27/latest-solar-superstorm-blinded-the-systems-that-prevent-satellites-from-crashing-in-space.html
Feminist Barbie vs. Reactionary Barbie: Why Mattel’s doll contains many identities,https://english.elpais.com/lifestyle/2024-07-29/feminist-barbie-vs-reactionary-barbie-why-mattels-doll-contains-many-identities.html
Bootleg influencers: How Gen Z is flaunting designer knockoffs that are bought online,https://english.elpais.com/lifestyle/2024-07-23/bootleg-influencers-how-gen-z-is-flaunting-designer-knockoffs-that-are-bought-online.html
The resurrection of Simone Biles,https://english.elpais.com/sports/olympic-games/2024-07-31/the-resurrection-of-simone-biles.html
"Climbing without a rope, between freedom and psychopathy",https://english.elpais.com/sports/2024-07-22/climbing-without-a-rope-between-freedom-and-psychopathy.html
